Event Name,Start,End,Location,Description,Organizer,Event URL,Relevance,City,Source CSV
Research Reading:  Prototyping Conversational LLM's With Alpaca,"July 26, 2023, 07:00 PM","July 26, 2023, 08:30 PM","330 7th Avenue #2nd floor, New York, NY 10001","LLM's have taken over the world, and their usability has had an unprecedented rate of increase in the last 6 months.  The Alpaca model developed by Stanford's computer science department represents an affordable way to turn pre-trained research LLM's into conversational chatbots that are on par with commercial models.  The project outlines a lot of the key aspects of building a chatbot: - How to generate and format the data necessary to train everything- Scripts for training the model with built-in parameters- Boilerplate code for serving models over Huggingface with GradioIt's quickly become the new standard for prototyping LLM models.  This talk is designed to give us a hands-on walk through the project, and take a deep dive through its github repo to dissect its most important parts.  This is meant to be a fast-acting introduction to the world of research LLM's, and prompt an open-ended discussion about the current state of language models.The homepage for the project can be found here:  https://crfm.stanford.edu/2023/03/13/alpaca.htmlThe github repo can be found here:  https://github.com/tatsu-lab/stanford_alpaca",https://www.eventbrite.com/o/data-science-and-machine-learning-research-group-63259869903,https://www.eventbrite.com/e/research-reading-prototyping-conversational-llms-with-alpaca-tickets-676798030127,True,NYC,/Users/raiidahmed/PycharmProjects/Event-Extractor-With-GUI/CSV_URL_DATA/AI Governance/AI_Governance_eventbrite_AI Governance_NYC.csv
Space Renaissance USA Networking Mixer,"July 27, 2023, 05:00 PM","July 27, 2023, 08:00 PM","1561 Bedford Avenue Brooklyn, NY 11225","Join us at SRI Kick-off Celebration on Thursday, July 27, 2023, at the Boys Club of New York.",Space Renaissance International,https://www.eventbrite.com/e/space-renaissance-usa-networking-mixer-tickets-647036572807,False,NYC,/Users/raiidahmed/PycharmProjects/Event-Extractor-With-GUI/CSV_URL_DATA/AI Governance/AI_Governance_eventbrite_AI Governance_NYC.csv
COS New York presents Article V of the U.S. Constitution & Self-governance,"September 21, 2023, 07:00 PM","September 21, 2023, 08:30 PM","1000 Richmond Terrace, Staten Island, NY 10301","Meet the Convention of States Action New York Team! Learn how the states can rein in our out-of-control federal government using Article V of the U.S. Constitution to convene an amendment-proposing convention. We the people have the power, using our state legislatures and the Constitution, to bypass Congress. We've had the power all along. Now we just need to use it.Convention of States Project is a nonpartisan, nonprofit organization whose goal is to limit federal government interference.19 states have invoked Article V of the Constitution to:1. Impose fiscal restraints on the federal government.2. Limit the power and jurisdiction of the federal government.3. Impose term limits on Congress and federal officials.D.C. will NEVER fix itself. The Founders gave us a safety switch. Help us save America!",https://www.eventbrite.com/o/mary-ellen-probanski-67214479743,https://www.eventbrite.com/e/cos-new-york-presents-article-v-of-the-us-constitution-self-governance-tickets-670701796127,True,NYC,/Users/raiidahmed/PycharmProjects/Event-Extractor-With-GUI/CSV_URL_DATA/AI Governance/AI_Governance_eventbrite_AI Governance_NYC.csv
Fundraising Breakfast #23,"August 22, 2023, 09:30 AM","August 22, 2023, 12:00 PM","6 Saint Johns Lane, New York, NY 10013","Please join us for our monthly Fundraising Breakfast at Spring Place New York, hosted by Ruben A. Austin, entrepreneur  and General Partner at Transatlantic Venture Partners.This month's guest speakers is are TBADuring this multi-course breakfast we will discuss how to raise venture capital and will give you the opportunity to mingle with investors and  startup founders.During our last fundraising breakfast we had over 70 attendees, including  venture funds, service providers and startup founders.Included: Multi-course breakfast, coffee and tea. Sponsored by TAVP, Vector  & Spring Place-----Agenda:09:15 AM  - Networking (Coffee & Tea Bar)10:00 AM - Panel Discussion 10:30 AM - Q & A11:00 AM - Post Panel Networking11:30 AM - Event Ends-----About Transatlantic Venture Partners: TAVP is an international syndicate investing into European and North-American early stage startups.About Vector: Vector is a premier fund administrator for closed-end alternative investment vehicles. With a commitment to building the next generation of fund administration, Vector offers their clients industry-leading technology, top-tier talent, innovative workflows, and a comprehensive suite of integrated fund services.About Spring Place: A workspace and private Membership club that creatively connects global professionals and entrepreneurs.",https://www.eventbrite.com/o/transatlantic-venture-partners-35465058703,https://www.eventbrite.com/e/fundraising-breakfast-23-tickets-637511834057,False,NYC,/Users/raiidahmed/PycharmProjects/Event-Extractor-With-GUI/CSV_URL_DATA/AI Governance/AI_Governance_eventbrite_AI Governance_NYC.csv
Ownership Economy Summit,"October 10, 2023, 08:30 AM","October 10, 2023, 06:30 PM","405 East 42nd Street, New York, NY 10017","The Ownership Economy Conference, held at the United Nations in New York City, on October 10th, 2023, will bring together a select group of investors, entrepreneurs, policy-makers, and thought leaders. The event will explore the people and ideas behind the technology, economics, and laws that are reimagining how the economy can work for everyone. Panelists and breakout sessions will feature leaders that are constructing a better economy, one based on broad-based ownership and democratic governance. The conference builds on 18 months of work of investigating the market for broad-based ownership on the Ownership Economy Podcast. For the most up to date agenda, please visit https://www.ownershipeconomy.com/conference-agenda",https://www.eventbrite.com/o/the-ownership-economy-66238656463,https://www.eventbrite.com/e/ownership-economy-summit-registration-640585698067,False,NYC,/Users/raiidahmed/PycharmProjects/Event-Extractor-With-GUI/CSV_URL_DATA/AI Governance/AI_Governance_eventbrite_AI Governance_NYC.csv
Develop a Successful Healthcare Tech Startup Business Today! Entrepreneur,"July 30, 2023, 01:00 PM","July 30, 2023, 05:00 PM","Virtual Workshop, New York, NY","Learn to Develop a Successful Healthcare Tech Startup Business Today!Always wanted to start an Healthcare Tech Startup? Now we have a complete blueprint for you start your own Healthcare Tech Startup Business. During our tech startup program you will learn and navigate through tools, software, hardware, platforms, resources, projects, processes, methods and strategies to penetrate your own Healthcare Tech Startup Business into different market's and industries. For more information visit our website at Atechup.com For more detailed information go to:  Atechup  Tech Entrepreneurship PageAccomplish 10X Performance Results compared to other StartupsReceive 10X Return Of Investment (ROI) than a college educationOur Tech Startup Program contains jam-packed with practical market & industry insightsOur team has done the market/industry research so you won't need toSave 10X of Your TimeLearn to Develop a Six-Figure Tech Startup from ScratchDiscover the Potential with Emerging TechnologiesGet a foot into a Billion Dollar IndustryFull Tech Startup MentorshipTech Entrepreneurship Certification/DiplomaGo From Beginner To Advanced Entrepreneur in No TimeStep by Step InstructionsComplete Tech Startup Business Setup: From Zero To Hero In No TimeNo Previous programming or tech background needed except an open mindsetGenerate sales in a B2B environmentGet a holistic overview of different tech startup processesDiscover new strategies and perspectives on developing your startupIncrease Your Creativity & Innovation IQSave money instead of taking loan for a college or university degreeExplore 100+ Healthcare Tech Startup Ideas in Emerging Markets & IndustriesDuring this Healthcare Technology  Entrepreneurship Workshop we will cover:Session 1: Healthcare Startup BasicsDuring this session we will explore the very foundation and the basic systems and platforms for you to integrate into your own tech startup process.HardwareSoftwarePlatformsProjectsSystemsBlueprintToolsResourcesSession 2: Healthcare Tech Startup Ideas, Trends, Solutions, ServicesDuring this session we will explore tech startup ideas for you to implement and integrate into your own tech startup or use them as an inspirational source for developing your own products, projects, prototypes or services in your tech startupAI Bio ProfilesBio Profiles Big DataBehaviour AnalyticsNiche Disease WearableDisease BioLockingHerb BioLocation PlatformBio design Bioapp MarketplaceHeart BioMonitoringAI Patient CareGenome Bio AnalyticsBio Energy AppAI Treatment AdviserBrain Performance BioMonitoringBio enhancement PlatformBioCloud PlatformBioVR Sleep LabSleep Lab AnalyticsBiosleep SensorsMicroscopic CV AIMicroscopic BD IPpH Bio Monitor Med Device AppBiomimicry Simulation VR/AR LabBio robotic AR SurgeryBioCycle Feedback SystemBio algorithm Data WarehouseHealthcare Enterprise IntelligenceBioSound TherapyVein ScannerNursery AI AssistancePharmaceuticals Calculator AppSilico Trials on DemandNano-medicineTelesurgeryVeterinary ScannerHealth sensors3D Bioprinting eMarketplaceOrgan Performance DashboardHealth Cloud InformaticsVirtual Health AssistantHealth Intelligence - Predicting DiseaseNutritional Alert SystemHealth Intelligence - Patient DiagnosticsEcoDroneCV RSMedical Herb Bioinformatics SystemHealth Intelligence - Curing SuggestionsHospital Vertical Farming PlatformHealthcare API Provider SaaSHealth Performance IntelligenceMedtech Cloud DocumentationMedical Images RPA RSBiological Age TestsPersonalized Medicine 3D PrinterBiomarker Lab-TestsBio Computational SimulatorSuper-foods Vertical FarmingDNA Sequence Cloud AnalyzerEncryption Blockchain Medtech SaaSCellular Performance Testing BioLabPersonalized Genome AnalyticsProbiotic Microbiome Lab TestsHealthy Food on Demand AppVR Mental Therapy StudioRent BioLab on DemandPersonal AI Doctor AppPhysicians AI AssistantHerbal Tea indoor Smart FarmingCRISPR Cloud on DemandBlood Nutrients AnalyticsInfertility Cloud AnalyticsCancer AI DNA Screen TestingBandAid SensorsBandAid MetricsFeeding Tube Analytics AppDigital eSkin MetricsPulse Oximeter Analyticsand much moreSession 3: Research and R&DDuring this session we will explore the research process, how you can research a specific niche industry, the market and tech trends.R&D/ResearchR&D ToolsStartup ToolsMarket ResearchSurveysConsumer AnalyticsMarket AnalyticsIndustry AnalyticsTrends Researching Session 4: Creativity & InnovationDuring this session we will explore the creativity process, how to increase your own creativity intelligence and implement quality tech ideas into your own tech startup process.Creativity ToolsCreativity TechniquesCreativity StrategyMind mappingBrainstormingMeditationIdea ExploringIdea BlenderKey-Point SystemProblem Solving StrategyIncubationCreative intelligenceOutside the Box ThinkingLateral ThinkingProductivity ToolsMind RelaxationMeditationHigher ConsciousnessesInspiration ToolsIdea Storage Session 5: Raise Capital & Funding & Venture CapitalDuring this session we will explore the capital and funding process of your tech startup. How to raise capital and make systematic attempts to penetrate into the market.Capital/FundingCapital/Funding ToolsCapital/Funding StrategyVenture CapitalistsAngel InvestorsSeed FundingIncubatorsAccelerator ProgramsCo-FounderCapitalization TableCrowdfundingBusiness Trade Fairs Session 6: Find Your First 100+ Customers, Sales & MarketingDuring this session we will explore the client acquisition process. Find your first clients and customers for your tech startup and implement the right tools, methods and strategies for creating an successful sale system for your specific niche industry/technology.ClientsClient Acquisition StrategyClient Acquisition ProcessPR StrategiesSocial Media MarketingCompetitive AnalysisE-Mail MarketingNewslettersAnalyticsSEODigital MarketingAd SystemsCompetitor ResearchSale SystemSale StrategyGrowth HackingSales FunnelEmail Hunting Session 7: Startup Platform & Business OperationsDuring this session we will explore the business organizing process. How to implement an organized and professional platform for your tech startup for creating efficient workflow.Business AutomationBusiness ProcessBusiness StrategyBusiness ModelBusiness ManagementERPCRMHuman Resources (HR)RecruitmentIntranetCollaborationProject ManagementDocument ManagementCustomer SupportBusiness Automation Tools Session 8: Startup FormationDuring this session we will explore the business formation process. Which platforms, models and tools to integrate into your tech startup formation for creating an successful launch process.LegalContractsBusiness ModelCorporate StructurePayment PlatformsPayment GatewayInvoicing SystemCredit Cards/PaymentsPricing StrategiesAccountingSubscriptionsOffice SpaceVirtual AddressVirtual PhoneVirtual OfficeRemote OfficeVirtual AssistantVirtual ReceptionistVirtual SupportOutsourcingProduct DemoProduct Launch Session 9: Startup Programing & UXDuring this session we will explore the coding process of your tech startup.IDEAPISDKGUICode AnalysisData VisualizationPythonC#FormsWireframingFront-EndBack-EndLibraryFrameworksTestingProgramming PlatformsProgramming ToolsAgile DevelopmentSoftware Code Management Session 10: Startup Hardware & Prototyping & InnovationDuring this session we will explore the hardware and prototyping process of your tech startup. Using different tools and platform to innovate and integrate your own tech startup projects.ElectronicsIoTRaspberry PiArduinoMicrocontrollersSensorsProjectsMicrochipsHardware BoardsHardware ToolsHardware PlatformPCB3D Design3D Models3D PrintingDIY TechTech LabEmbedded Systems Session 11 : Startup IT & Tech OperationsDuring this session we will explore the IT infrastructure process of your tech startup. Which platforms to use for setup an organized database system, cloud system and other technical solutions for your tech startup to work efficientlyIT InfrastructureCloudServersDatabaseDevOpsMonitoringRemote AccessBackupTechnical DocumentationData RecoveryEncryptionSecurityFTPNASDeploymentVPNVPSAutomationLog ManagementNetworkingVirtualization Session 12 : Startup ConsultingDuring this session we will explore the consulting process for your tech startup. An strategic approach, where you can receive more experience before you launch your own specific products/projects.Tech Startup ConsultingTech Consulting ServicesTech Consulting StructureTech Consulting ApproachTech Consulting StrategyTech Consulting ContractsTech Consulting ReferralsTech Consulting PortfolioTech Consulting ISOTech Consulting IntegrationTech Consulting Projects Session 13 : Startup ManagementDuring this session we will explore management process of your tech startup. How to manage your internal and external environments for increasing the probability of your tech startup to succeed.Tech Startup ManagementMotivational SkillsTime ManagementTeam ManagementLeadership SkillsLearning SkillsGoal Setting SkillsDecision Making SkillsStress ManagementCommunication SkillsProcrastination HacksProductivity HacksConfidence HacksGrowth Mindset SkillsProblem Solving SkillsAnalytical SkillsStrategic Thinking SkillsLearning ManagementSession 14, 15, 16, 17, 18, 19, 20: Tech EntrepreneurshipDuring this session we will explore tech entrepreneurship topics, concepts, strategies etc.Achievement's & CelebrationCreator & Producer MindsetBootstrappingVC FundingAngel Investor FundingBusiness Acquisition, M&ABusiness ModelObsessionLife SacrificesStrategic MindsetMarket TestingProduct ExperimentationMarket TimingUSPMarket TrendsMarket ResearchMarket NeedMarket DemandMarket AssumptionsMarket PenetrationIdeas & ActionBusiness VisionsNew ProductAlliancesPrerequisite trainingProduct BlueprintPayment OptionsDelivery TimeProduct PackagingRisk ManagementQualityEducate the MarketDisrupting TechMarket TerritoryResourcefulCustomer FeedbackFounding vs CofoundingComplexity ManagementEngineeringProduct MetricsHigh PressureCredibilityBusiness ReputationAsset ManagementBusiness PerformanceCRMBusiness AppraisalData Driven Decisions vs Gut FeelingIdentify Pain PointsCXMarket PositioningCost ManagementStrengthsWeaknessSustainabilityProfitabilityMonitoring & LoggingPitchingFocusProblem SolvingAppointmentsRoad MappingPersistenceGross MarginRevenueCostsProfitCalculationsAnalyticsSales ForecastingSales FunnelsFinancial StatementsProfit & Loss StatementsPricing TableDistributionDue DiligenceGrowth RateRecurring RevenueUp-saleCross-sellingSubscriptionsPredictabilityStartup LongevityLoyal Consumer BaseFollowersProspectingBANT ModelEmail ListsProduct DiversificationCEO BIObjectionsRejectionsSurveyStartup RecipesPattern RecognitionPurchase SignalsPotential Customer ListeningTrial CloseBusiness NewsOpportunity Detecting AlgorithmsStartup TemplatesHabit TrackingEnergy LevelsTo-Do ListsNetwork ScanningStartup Formula EncryptionDistractions BlockStartup DisassemblyStartup GeoMirroringSmart TranslatingRemote ControlStartup Spin WheelStartup ValuationJoint VentureOutsourcingDigital NomadsCrowdfundingVALaunch ProcessCustomer OnboardingProduct Market FitKPIIPPRPivotStartup ScalabilityTractionUnicornGrowth HackingExplainerChurn RateCACLaw of EntropyBurn RatePitch DeckExit StrategyFMAGamificationStartup Iteration CycleLTVMVPCTRSweat EquityTerm SheetSLACTASaaSCustomer JourneyCustomer Satisfaction MetricsInbound MarketingLanding PagePayment GatewayMRRPQLCRCValue GapCold EmailDemand GenerationICPFor more detailed information go to our website Atechup.comWorkshop CurriculumBasic Edition: Session 1-44 Hour Tech Startup Entrepreneurship WorkshopPremium Edition: Session 1-820+ Hours of Tech Startup Web Workshops24/7 SupportFor more information visit our website at Atechup.com Gold Edition: Access to ALL Sessions.Step by Step Develop a Successful Startup MentorshipStartup Hacks, UX, SaaS, App, Web50+ Hours of Tech Entrepreneurship Content1 Year Membership/Subscription (365 Days)24/7 VIP SupporteCertification/DiplomaOn-Demand Access 24/71080p Full HD / 4K Video Quality30.0000+ Potential Clients List PDF,1000+ PR Contact List PDF,1000+ Journalists/Tech Blogs Contact List PDF,1000+ Tech/Startup Slack Communities List PDF,2500+ Potential Customers/Clients Contact List PDF,2000+ Venture Capital/Startup Funding List PDF,1700+ Startup Accelerators List PDF,For more information visit our website at Atechup.com [This is an Online Web Workshop][Atechup Terms & Conditions Apply]Develop a Successful  Smart Tech Startup Business Hackathon | Startup Hackathon | Entrepreneur Hackathon | Entrepreneurship Workshop | Entrepreneur Class  | Tech Workshop  | Tech Hackathon  | Tech Bootcamp  | Tech Class  | Tech Webinar  | Entrepreneur Bootcamp  | Entrepreneur Webinar  | Startup Webinar  | Startup Class  | Entrepreneur Conference  | Startup Conference  | Tech Startup Conference  | Business Conference  | Business Networking  | Startup Networking  | Startup Classes  | Entrepreneur Classes  | Business Training  | Entrepreneurship Training  | Startup Training  | Entrepreneur Training  | Tech Workshop  | Startup Workshop  | Entrepreneur Workshop Testimonials:""Atechup Startup Workshops is the most valuable business workshop we have EVER purchased."" - Johnny M.""Not able to tell you how HAPPY I am with Atechup Startup Workshops."" - Elisabeth F. T.""Atechup Startup Workshops, is a visionary product, shaping FUTURE tomorrow"" - Cohen. A""I am completely blown away by the QUALITY and generous material. Thank you very much"" - Steven D.""Your company is TRULY upstanding and UNIQUE. I have gotten at least 50 times the VALUE from your Workshops."" - Xinye T.""I have FUNDED my Startup with Series A for the first time and its all THANKS to Atechup workshops"" - F. Martinez",https://www.eventbrite.com/o/atechupcom-15646132597,https://www.eventbrite.com/e/develop-a-successful-healthcare-tech-startup-business-today-entrepreneur-tickets-501222388657,False,NYC,/Users/raiidahmed/PycharmProjects/Event-Extractor-With-GUI/CSV_URL_DATA/AI Governance/AI_Governance_eventbrite_AI Governance_NYC.csv
Rhymes Against Humanity: The Poetry of Chat GPT,"August 01, 2023, 12:00 PM","August 01, 2023, 01:00 PM","144 Montague Street, Brooklyn, NY 11201","This in-person, weekly drop-in class, which might also have been called RAGE AGAINST THE ROBOTS, will delve into the poetic consciousness of Chat GPT, exploring the unique ways in which this particular artificial intelligence language model generates, processes and produces “poetry.” We'll examine the intricacies and limitations of its syntax and discuss the creative possibilities that arise from using computers as inspiration. Each class will involve some AI-inspired prompts, exercises and challenges as we explore new avenues for poetic expression. We'll consider the ethical implications of using artificial intelligence for artistic expression, discussing how its use in the creative process complicates our understanding of authorship, authenticity and originality. Finally, as some of you may have already begun to suspect, Chat GPT generated the majority of the text you are reading right now as part of the description for this class, which might also have been called CODE X: SIMULATED FREE VERSE. (Note that drop-in classes are not a forum for critique of work; students looking for critique should register for multi-week workshops.)COVID-19 PolicyWe are dedicated to keeping up with the latest info on COVID-19 to inform the policies we use to keep each other safe. This means they may differ from local mandates. Below is our policy for in-person workshops, events and other gatherings hosted at our space at 144 Montague.All attendees are strongly encouraged to wear masks. Please stay home if you are experiencing symptoms, have a positive COVID test or someone close to you has recently tested positive. We are a multi-generational community and hope you will continue to take actions to keep yourself and others around you safe.Workshop instructors or event hosts may choose to enforce a more stringent policy at their own discretion. Additionally, workshop participants may be required to wear masks as an accessibility accommodation for other participants or the instructor.While we do our best, Brooklyn Poets cannot guarantee zero risk. A risk of exposure to COVID-19 exists in all public settings. By entering the building, students, teachers and other attendees accept the risk of exposure and knowingly waive and release Brooklyn Poets from any liability related to COVID-19.Brooklyn Poets Code of ConductBrooklyn Poets will not tolerate any instances of discrimination, harassment or abuse in conjunction with any of our programs. Respect and consideration for others, both within and outside our programs, are core values to be upheld by all participants. Discrimination against and/or harassment of community members on the basis of race, ethnicity, sex, gender identity or expression, sexual orientation, disability, national origin, religion, age, marital status, veteran status or any other factor is unacceptable and will not be tolerated. Program participants are expected to adhere to all federal, state and local laws and regulations. Should a board or staff member, independent contractor, volunteer or program participant be found to violate any aspect of the organization’s code of conduct, Brooklyn Poets reserves the right to dismiss them from the program. Consequences may include, but not be limited to, dismissal from the current activity, suspension, ineligibility for all future activities, and/or loss of payment or fees. If you have any issues to report, please do not hesitate to contact Board President Jordan Myers (myers@brooklynpoets.org), Executive Director Jason Koo (koo@brooklynpoets.org) or Deputy Director renée kay (kay@brooklynpoets.org), and they will get back to you as soon as possible.",https://www.eventbrite.com/o/brooklyn-poets-30652576500,https://www.eventbrite.com/e/rhymes-against-humanity-the-poetry-of-chat-gpt-tickets-644916962997,False,NYC,/Users/raiidahmed/PycharmProjects/Event-Extractor-With-GUI/CSV_URL_DATA/AI Governance/AI_Governance_eventbrite_AI Governance_NYC.csv
