Event Name,Start,End,Location,Description,Organizer,Event URL,Relevance,City,Source CSV
Responsible Tech Mixer NYC,"July 26, 2023, 06:00 PM","July 26, 2023, 08:30 PM","29 Little West 12th Street, New York, NY 10014","T﻿here is a robust Responsible Tech movement brewing in NYC...attend our upcoming Responsible Tech Mixer to building community and share your ideas with 200 people committed to tackling wicked tech & society issues and co-creating a tech future aligned with the public interest! This gathering is being done with support from Mozilla and Tekalo. C﻿ome join us to meet others who deeply care about building a better tech future, listen to a panel conversation about strengthening the ecosystem, and enjoy some food/drinks while mingling with the Responsible Tech community! A﻿ll Tech Is Human has a wide range of activities aimed at multistakeholder community-building, multidisciplinary education, and diversifying the traditional tech pipeline with more backgrounds, disciplines, and perspectives. We have a Slack community of over 5k members across 70 countries, a large mentorship program, regular summits & mixers, open working groups, reports, our Responsible Tech Job Board + Talent Pool, and much more. See all of our projects and links here. C﻿urious about our mission and accomplishments? You can read about that here!The panel will feature...Danielle Sutton- Senior Consultant at Deloitte, Trustworthy AI Strategist. Danielle Sutton is a 5th generation Harlemite who is currently a Senior Consultant at Deloitte in their Government and Public Services Strategy & Analytics Practice. She has been with the firm for 4 years, focusing her work on the intersection of Trustworthy AI and criminal justice. In 2022, she helped spearhead Deloitte’s first annual ethical tech report entitled “State of Ethics and Trust in Technology”. Prior to consulting, she graduated Summa Cum Laude from Vanderbilt University with a degree in Political Science and Psychology and worked at the Neighborhood Defender Service of Harlem researching algorithmic bias in policing software. Danielle is passionate about creating a more equitable tech future and will be pursuing an MPhil in Technology Policy at University of Cambridge in the fall.Kristina Francis is the executive director of JFFLabs. In this role, she oversees advisory, acceleration, data, and investing initiatives that connect traditional systems with systems disruptors to enable equitable economic mobility. Kristina has more than 20 years of experience in corporate operations and entrepreneurial ventures focused on management consulting, business development, software and data integration, and impact investing competencies.Ginny Fahs: Director, Product R&D - Innovation Lab at Consumer Reports. Prior to joining Consumer Reports, Ginny was a software engineer at Uber and a Technology Policy Fellow at the Aspen Institute.  At Aspen, she focused on cybersecurity for the elderly and contributed research and design prototypes that are currently being adopted by U.S. government agencies including the Federal Bureau of Investigation, Federal Trade Commission, and Department of Homeland Security. She also co-founded #MovingForward, a nonprofit social enterprise that fights harassment and discrimination in startup investing. Ginny holds a Bachelor of Arts in History & Literature from Harvard University and a Master’s in Business Administration from INSEAD, a global business school with campuses in Europe and Asia.Flynn Coleman is an author, an international human rights attorney, an environmental advocate, a Fellow at Harvard and Yale, and a professor. Flynn is the Fernand Braudel Senior Fellow in the Department of Law at the European University Institute in Florence, Italy, and is also a Visiting Researcher at the University of Copenhagen in the Law Faculty. She has been named a Technology & Human Rights Fellow at the Harvard Kennedy School of Government and the Carr Center for Human Rights Policy.A﻿ll Tech Is Human Associate Director Rebekah Tweed will moderate.",https://www.eventbrite.com/o/all-tech-is-human-30037722440,https://www.eventbrite.com/e/responsible-tech-mixer-nyc-tickets-667123924617,True,NYC,/Users/raiidahmed/PycharmProjects/Event-Extractor-With-GUI/CSV_URL_DATA/AI Governance/AI_Governance_eventbrite_Social AI_NYC.csv
Asian Secret Singles Social Event: A New Way To Meet Asian Singles In NYC,"August 16, 2023, 07:00 PM","August 16, 2023, 09:10 PM","New York - Midtown Manhattan ANNOUNCED AFTER SIGN UP, New York, NY 10022","Come and check out this revolutionary new event for Asian singles in NYC.WHAT IS SECRET SINGLES SOCIAL?Secret Singles Social is an event that is changing the way people meet people in NYC. Have you ever been at a bar or lounge, looked around and wondered, ""Who is single in here?"". This event was born when the founder of the company found himself sitting at a bar and wondering exactly that. He then thought, ""Wouldn't it be cool to know who was single?"". The light bulb went off and he created the Secret Singles Social Event...This event is the perfect, laid back way to meet other Asian singles at your own pace without the endless swiping on dating apps and the pressure of going on one on one dates.***************************************************WE DO DIFFERENT AGE RANGES FOR EACH SECRET SINGLES SOCIAL EVENT SO CHECK THE CALENDAR BELOW FOR EVENT DATES AND AGE RANGES:* QUICK NOTE - WE REALIZE THERE ARE SEVERAL TICKET LISTINGS FOR AUGUST 16th - THEY ARE ALL THE SAME EVENT SO JUST CHOOSE ANY ONE OF THE TICKET LINKS... SORRY FOR ANY CONFUSION)EVENT CALENDAR:WEDNESDAY AUGUST 16th - Ages 20s, 30s & 40sWEDNESDAY SEPTEMBER 13th - Ages 20s & 30sWEDNESDAY OCTOBER 11th - AGES 30s, 40s & 50s***************************************************QUICK IMPORTANT NOTE:THERE WILL BE SINGLES FROM OTHER ETHNIC GROUPS ATTENDING THIS EVENT AS WELL BE WE INVITED A LOT OF INDIAN SINGLES SO WE EXPECT A GOOD AMOUNT OF ASIAN SINGLES TO BE IN ATTENDANCE. ALL ASIAN SINGLES WITH HAVE A UNIQUE SYMBOL (EXPLAINED BELOW) SO YOU'LL EASILY BE ABLE TO FIN D THE OTHER INDIAN SINGLES AT THE EVENT... HOWEVER YOU'RE CERTAINLY NOT LIMITED TO MINGLING WITH ONLY THE INDIAN SINGLES AT THE EVENT... FEEL FREE TO MINGLE AND CONVERSE WITH ANY OF THE OTHER PEOPLE IN ATTENDANCE AS WELL. KEEP IN MIND THAT THOSE WITH A DIFFERENT SYMBOL THAN YOU MIGHT NOT BE SINGLE BECAUSE THIS EVENT IS PART OF A BIGGER NETWORKING EVENT. NOT ALL OF THE CROWD WILL BE ASIAN AND NOT ALL  OF THE CROWD WILL BE SINGLE. YOU'LL BE ABLE TO EASILY IDENTIFY THE INDIAN SINGLES BY THEIR SECRET SYMBOL. THE MAGIC OF THE EVENT IS THAT YOU'LL BE ABLE TO FIND THE OTHERS THAT MATCH WHAT/WHO YOU'RE LOOKING FOR BECAUSE THEY'LL HAVE THE SAME SECRET SYMBOL AS YOU. FOR EXAMPLE, THOSE IN THE REAL ESTATE INDUSTRY MIGHT HAVE A STAR AS THEIR SECRET SYMBOL, THOSE WHO ARE ASIAN SINGLES MIGHT HAVE A DIAMOND WITH A DOT IN THE MIDDLE OF IT AS THEIR SECRET SYMBOL, ETC... IN  OTHER WORDS, YOU CAN FEEL FREE TO MINGLE AND CONNECT WITH EVERYONE AT THE EVENT BUT YOU'LL EASILY BE ABLE TO LOCATE THE OTHER ASIAN SINGLES BECAUSE THEY'LL HAVE THE SAME SECRET SYMBOL AS YOURS!SECRET LOCATION & SECRET SYMBOL:Each Secret Singles Social Event is held at a different secret location in Manhattan. We always choose quality bars that are generally somewhere near midtown. We choose venues that are easy to get to for most people in NYC (We don't pick places above 79th St. or Below 25th St. so they are easy for most people to get to by Subway or Uber). This is not a structured or overly organized event. Think of it as a fun alternative to going to grab some drinks at a bar alone. Feel free to come with a friend/s as well. We'd say about 75% of the crowd comes on their own. We kept the event price much more affordable than a standard singles event so everyone can afford it.After signing up you will get an email from us with the location of the event. In that email we'll also give you a secret symbol that will let the other attendees know you're part of the event. We will email you a printable paper bracelet template with your secret symbol on it (SEE IMAGE BELOW TO BETTER UNDERSTAND WHAT WE MEAN). If you don't have access to a printer you can simply draw that secret symbol on the back of your hand with a marker or pen before arriving at the event.Then you simply show up at the venue at the listed start time and get started meeting people. There are no name tags, no host and no awkward check-in process. This means that only you and the other attendees will even know that you're at a singles event! (The venue is not directly involved with the event so please don't ask their staff questions as they likely won't have answers)...You'll simply look for other people with the secret symbol on their hand to know they're also single and part of the event.ICEBREAKERS TO WIN A $50 AMAZON GIFT CARD!Before the event we'll also email you icebreaker questions that you can use to get to know the rest of the singles at the event. The icebreakers are optional but most people love them because they really help you get to know people and gauge compatibility. In the email we send you before the event we'll explain exactly how the icebreaker works but essentially you'll be asking and/or being asked 3 icebreaker questions. If you complete the icebreaker you'll be entered into a raffle and one of the event attendees will win a $50 Amazon gift card!EXAMPLES OF SOME OF OUR FUN ICEBREAKER QUESTIONS:* If you had a time machine - where would you take it to? Would you stay there?* Do you usually follow your heart or your head?* Would you rather live for one year on an island by yourself or for one year in a small apartment with 7 strangers?* What is one thing you’ve always wanted to cross off your bucket list, but haven’t yet?WHAT PEOPLE ARE SAYING ABOUT SECRET SINGLES SOCIAL EVENTS:""I was getting tired of the endless swiping on dating apps so thought I'd try something new. It was refreshing meeting people in real life in such a laid back and relaxed way"". ""An ingeniously mysterious and fun way to meet singles"" - Social Vibes Podcast""It basically just looked and felt like I was just having a cocktail  at a bar but at the same time I also to interact with some cool people. My best friend met her current boyfriend at one of these events so I thought I'd give it a try. I was happy I did. It was a great experience."" .""I loved the icebreaker questions because it takes the pressure off having to come up with something to talk about"" WHAT THIS EVENT IS NOT:Keep in my that there are no hosts and this not an overly structured or organized event. It's just a fun, clever way to meet other singles in your age range. Essentially we're providing you with a meeting place and an activity to help  you make connections. It's the perfect way to meet people at your own pace. We've witnessed countless relationships and connections form at Secret Singles Events so come on out!FAQ:HOW MANY WILL BE ATTENDING?It ranges from event to event. We usually have between 15 and 50 people sign up.WHAT IS THE AGE RANGE?It varies from event to event so check the calendar. If you're within a few years of the suggested age range you're welcome to attend.CAN I COME ALONE?Yes, about 75% come on their own.WHAT IS THE DRESS CODE?While we don't have a dress code we ask that you please look neat/presentable. What you wear to work, for after work drinks or on a semi casual date is likely fine.CAN I PAY AT THE EVENT DOOR?We do not accept payment at the event door. We also change the venue at each event and don't give out the location to those who don't sign up. You must pre-pay online.HOW LONG DOES THE EVENT GO?The event is 2 hours long, however the venue won't kick you out after 2 hours. So if you're having some good conversation you're welcome to stay there as long as you'd like.IS THERE A REFUND POLICY?If you need to cancel, please email us and we can transfer you to a future event. However we do not offer transfers if you cancel on the day of the event or don't show up.",https://www.eventbrite.com/o/social-events-20157541940,https://www.eventbrite.com/e/asian-secret-singles-social-event-a-new-way-to-meet-asian-singles-in-nyc-tickets-664013270567,False,NYC,/Users/raiidahmed/PycharmProjects/Event-Extractor-With-GUI/CSV_URL_DATA/AI Governance/AI_Governance_eventbrite_Social AI_NYC.csv
Little Island Social Walk (50s & Over),"July 30, 2023, 12:00 PM","July 30, 2023, 01:30 PM","51 10th Avenue, New York, NY 10014","The park provides a one-of-a-kind relationship between nature and art—a break from urban life and a connection to spontaneity and joy. It's become NYC's newest and hottest attraction!We'll make several stops along the park so that people can take pictures and admire the beautiful views. We'll circle the island a couple of times and then afterwards, we'll continue the walk along the Hudson River.Our social walks are an extremely popular way to meet others in a safe, outdoor setting. Enjoy a fun way to meet others while getting some fresh air and exercise. This event very casual and non-awkward + our host will help to make introductions.During the walk, you will randomly be paired with others in the beginning then rotate at designated times so that you get to meet everyone participating. Afterwards, you're welcome to hang out and exchange contact info with others.FAQs:Where to meet? Exact meeting location with host contact info will be sent to all paid attendees day of the event.How many will attend? We are limiting the # of attendees so that there's enough room for everyone to feel comfortable.What if rains? We will email attendees a new date.Can I come alone? Yes, about 90% come on their own.Ages? 50s & Over. Gender balance is not guaranteed but we usually get a good mix.",https://www.eventbrite.com/o/nyc-social-group-31639983301,https://www.eventbrite.com/e/little-island-social-walk-50s-over-tickets-661739088427,False,NYC,/Users/raiidahmed/PycharmProjects/Event-Extractor-With-GUI/CSV_URL_DATA/AI Governance/AI_Governance_eventbrite_Social AI_NYC.csv
Afterwork Fridays Cigar Social,"July 28, 2023, 06:00 PM","July 29, 2023, 12:00 AM","100 River Street, Hastings-on-Hudson, NY 10706",,https://www.eventbrite.com/o/emmaskitchensllc-40584364743,https://www.eventbrite.com/e/afterwork-fridays-cigar-social-tickets-619159220897,False,NYC,/Users/raiidahmed/PycharmProjects/Event-Extractor-With-GUI/CSV_URL_DATA/AI Governance/AI_Governance_eventbrite_Social AI_NYC.csv
"""IN DA MOMENT""SOCIAL MEDIA ROOFTOP NETWORKING MIXER!","August 18, 2023, 07:00 PM","August 18, 2023, 11:00 PM","230 5TH AVENUE, Manhattan, NY 10001","Networking for Social Media Specialists, Content Creators, Digital Marketing Experts, Influencers for Instagram, TikTok, Reddit, Facebook, Snap, Youtube. The Details: network on one of the best rooftops in NYC.Whether you are a Social Media Analyst, Content Creator, Digital Advertiser Expert, Influencer or in some other aspect of the Social Media industry, this event is the perfect opportunity to get away from your desk, have some cocktails and network with potential business partners, investors, industry professionals and new clients…. Or just come on out and make some new friends! We’ve witnessed countless business connections and friendships form at our past events. This is a private ticketed event onlyWhat to expect:up to 200 people with whom to further your career and create further opportunities for yourself.delicious food and drink!pristine views!if it rains, we will be secured in a private room or covered area 100% guaranteed!This is an NYC BRIGHTEST partner event which will be enjoyable. If you are an essential worker, please enter the promo code” social” for $2 off at checkout. For all upcoming events, check out nycbrightest.com, follow NYCBrightest on Eventbrite and nyc_brightest on Instagram.The Venue:230 Fifth PenthouseAddress: 230 5th Ave, New York, NY 10001Website: 230-fifth.comPhone: (212) 725-4300",https://www.eventbrite.com/o/nycbrightest-21845291059,https://www.eventbrite.com/e/in-da-momentsocial-media-rooftop-networking-mixer-tickets-685589987107,False,NYC,/Users/raiidahmed/PycharmProjects/Event-Extractor-With-GUI/CSV_URL_DATA/AI Governance/AI_Governance_eventbrite_Social AI_NYC.csv
BIOADAPTED,"September 07, 2023, 07:30 PM","September 07, 2023, 09:00 PM","5-25 46th Avenue, Queens, NY 11101","Transforma Theatre presents BIOADAPTED, a theatre reenactment investigative documentary with actors portraying real people and scientists, paired with humorous and eerie fictional pieces about what our future might look like if the AI propagates in unethical ways that don't serve humankind.Bioadapted employs texts about AI, some of which have been generated by GPT-3. An EEG headset will generate BCI (brain-computer-interface) instructions for the movement of an actor linked with a haptic vest and LED lights sewn into the costume.. In the grand finale the audience will put GPT-4 on trial and interrogate it directly in real time.Our goal is to investigate, interrogate, and educate all while delivering a unique, interactive, science-enhanced experience using technology. AI regulations and their implementation in government systems concern all of us, and through our process of blending art and science, we make these issues ""digestible"", empowering audiences to become active decision makers and alert citizens protecting their own agency and human sovereignty.Created and Directed by Tjaša FermeWritten by Alexis Roblan, James Yu, Tjaša Ferme, including real transcripts and interviewsAssistant Director: Nasay AnoTechnology Director: Heidi BoisvertSet Design: Oliver ZellerVideo Design: Jeremy BennetLight Design: Nicole E. LangSound Design: Liam Bellman-SharpeCostume Design: Alex C. WebsterBCI Assistant: Jingyao ShaoRun time: 90 minutes The doors will open 30 minutes before the show.T﻿ransforma Theatre is a part of the Culture Lab LIC Emergence Artist Residency program. A residency that offers space, time to realize performance based projects.This project is supported by funds from the New York State Council on the Arts, Edith Lutyens and Norman Bel Geddes Design Enhancement Fund, Statewide Community Regrants Program (formerly the Decentralization program) with the support of Governor Kathy Hochul and the New York State Legislature, and administered by Flushing Town Hall.",https://www.eventbrite.com/o/culture-lab-lic-is-an-arts-and-community-resource-center-30080755578,https://www.eventbrite.com/e/bioadapted-tickets-673102526777,False,NYC,/Users/raiidahmed/PycharmProjects/Event-Extractor-With-GUI/CSV_URL_DATA/AI Governance/AI_Governance_eventbrite_Social AI_NYC.csv
#MechanicsPort Virtual Job Fair / Career Expo Event #NewYork #NYC,"August 04, 2023, 11:00 AM","August 04, 2023, 02:00 PM","Virtual, New York, NY 10007","This Virtual Career Fair Event is Conducted on the First Friday of the Month.Event link: https://jobfair.tao.ai/pod/mechanicsportTo signup:Visit https://mechanicsport.com/wertual/login/jobfair and complete the profile.What to expect before #Jobfair?1. 2-3 days before the event, Info@TAO.ai will email* Job Seekers/Recruiter that have completed their #JobFair profile about their match status and next steps.* This email can land in your SPAM folder. Make sure to add info@tao.ai as a contact, and never miss out.2. On the day of the event, JobSeekers and Recruiters will visit their #JobFair page to participate in #MechanicsPort #JobFair[ Link: https://mechanicsport.com/wertual/jobfair ].What are the Benefits? We expect the event to:1. Provide seamless access to local/global talent and job opportunities2. Connect professionals with other seekers so they can collaborate and support each other3. Provide resources to support long-lasting career growth#MechanicsPort #Jobs Event is conducted using #JobFair by TAO.ai, World’s largest attended career fair with around 200,000 professionals and 8000 recruiting companies. #MechanicsPort #JobFair will target: Community of professionals from mechanics, and technicians.Have more questions? Visit Event FAQ/Reachout Page at: https://mechanicsport.com/wertual/jobfair/faqLearn More:Wertual by TAO.ai is a proud member of the NoWorkerLeftBehind initiative to promote, connect, and re-educate the global workforce through people-centric advanced analytics and technology.About TAO and Wertual:At TAO.ai, our vision is: No Worker Left Behind, and we use advanced analytics and technology to deliver on this ambitious scalable vision.Wertual is an app by Tao that hosts World’s Largest AI-powered community where people-help-people grow/succeed. Wertual by TAO.ai brings relationships and connections back into career development.Industries Hiring @ Wertual Job Fair:Advertising, Aerospace, Agriculture and Agribusiness, Air pollution, Arms, Automotive, Broadcasting, Chemical, Computer, Construction, Creative, Defense, Education, Electric power, Electronics, Energy, Entertainment, Fashion, Film, Financial services, Fishing, Floral, Food, Healthcare, Horticulture, Hospitality, Industrial robot, Information, Insurance, Internet, Leisure, Low technology, Machine tooling, Machining, Manufacturing, Market research, Mass media, Mass production, Materials science, Meatpacking, Mining, Music, News media, Occupational injury, Occupational noise, Oil shale, Petroleum, Pharmaceutical, Pricing, Professional services, Publishing, Pulp and paper, Raw material, Real estate, Robber baron (industrialist), Semiconductor, Services, Shipbuilding, Software, Sport, Steel, Telecommunications, Textile, Tobacco, Trade association, Transport, Video game, Water, Wood, etc.Keywords:CareerFair, JobFair, JobExpo, CareerExpo, Career Fair, Job Fair, Career Expo, Job Expo, Recruiter Event, Diversity, Equality, Equal Opportunity, Equal Opportunity , #mechanic, #technician, #virtual, #online, community #Virtual #ONL",https://www.eventbrite.com/o/jobsofficeorg-30068395660,https://www.eventbrite.com/e/mechanicsport-virtual-job-fair-career-expo-event-newyork-nyc-tickets-256903865377,False,NYC,/Users/raiidahmed/PycharmProjects/Event-Extractor-With-GUI/CSV_URL_DATA/AI Governance/AI_Governance_eventbrite_Social AI_NYC.csv
Selling on Instagram!,"July 27, 2023, 06:30 PM","July 27, 2023, 08:00 PM","275 Lenox Ave, New York, NY 10027","Join us for the BEST PRACTICES FOR SELLING ON INSTAGRAM
In this class you will learn how to:
•create copy highlighting your product
•connect with your target audience
•visually feature your product
•create an optimized page
All organically, without ads. This class is created for business owners who have an Instagram presence and at least one physical product. If you have a beginner level of experience on Instagram, this is the class for you.This workshop will be facilitated by Sidra Robertson*﻿**Reserve your tickets soon, seating is limited and on a first come first served basis.",https://www.eventbrite.com/o/harlem-business-alliance-7742511837,https://www.eventbrite.com/e/selling-on-instagram-tickets-677424423687,False,NYC,/Users/raiidahmed/PycharmProjects/Event-Extractor-With-GUI/CSV_URL_DATA/AI Governance/AI_Governance_eventbrite_Social AI_NYC.csv
