"['ERROR 2023 HONG KONG DRAGON BOAT FESTIVAL IN NEW YORK', 'August 12, 2023, 11:00 AM', 'August 13, 2023, 11:00 AM', 'FLUSHING MEADOWS PARK', 'Our 2023 festival is scheduled on Aug 12 and 13', 'HKDBFNY, INC.', 'https://www.hkdbf-ny.org/index.php']"
"['ERROR Movie Nights', 'July 15, 2022, 8:00 PM', 'July 15, 2022, 10:00 PM', 'State Parks', 'Enjoy a movie night under the stars with friends and family!', 'Parks, Recreation and Historic Preservation', 'https://parks.ny.gov/events/event.aspx']"
"['ERROR City of Water Day', 'July 15, 2023,12:00 PM', 'July 15, 2023,5:00 PM', 'Field Station', ""RETI Center is hosting a City of Water Day workshop at our Field Station that is sponsored by GBX~ Gowanus Bay Terminal. Join us to help build and launch our next Floating Garden. Handbuilt by volunteers like you, they create a mini-ecosystem that incorporates marsh grasses, mussels, oysters, and kelp. You'll help us build one using only salvaged and sustainable materials like scaffolding planks, reclaimed fishing nets, wine corks, salvage steel, and more. All skill levels and ages welcome. Refreshments, all tools and supplies provided."", 'Waterfront Alliance, the NY-NJ Harbor & Estuary Program, and The Hudson River Foundation', 'https://www.reticenter.org/events/city-of-water-day']"
"['ERROR Infinite Mussel Party', 'May 18, 2023, 6:00 PM', 'May 18, 2023, 11:00 PM', 'RETI Center, 701 Columbia Street, Brooklyn, NY, 11231, United States', 'Please join us for our Spring Celebration at the RETI Field Station on the Gowanus Bay at GBX Terminal. A climate-action barge floating in the industrial landscape of South Brooklyn. Tickets can be purchased here. Join RETI Center and learn about our Mussel and Sugar Kelp Aquaculture Program, BlueBlock Floating Gardens, Local Power, and more. An evening of gumbo, cocktails, and dancing', 'Generously sponsored by GBX~ Gowanus Bay Terminals', 'https://www.reticenter.org/events/infinite-mussel-party']"
"['ERROR Ocean Stewardship from the Bronx to Brooklyn', 'March 24, 2023, 1:00 PM', 'March 24, 2023, 4:00 PM', 'Bronx Kill Park to Gowanus Bay', 'A Boat Tour Envisioning Ecology, Economy and Equity for East River Communities', 'New York Water Week and the UN Water Summit', 'https://www.reticenter.org/events/tour']"
"['ERROR Local Power Community Solar Info Session', 'Thursday, November 17, 2022, 6:30 PM', '7:35 PM', 'RETI Center', ""Switch your electric account to Local Power, a brand new community solar program that lets you cut your energy costs every month. You'll start getting your power from large-scale solar energy systems on commercial buildings in the neighborhood. That means you can go solar without installing a system on your roof - the savings guaranteed, and it's free to sign-up! H\ufeffelp us create our local green power system. You'll learn where the systems are being installed and we'll discuss opportunities for investment and even ownership in a program that benefits the whole community, including training and jobs for our low-income populations."", '', 'https://www.reticenter.org/events/local-power-community-solar-info-session']"
"['ERROR Urban Ocean Stewardship', 'November 9, 2022, 9:00 AM', 'November 9, 2022, 12:00 PM', 'N/A', 'An initiative to ensure restoration and equity in our sixth borough', 'N/A', 'https://www.reticenter.org/events/stewards']"
"['ERROR BlueBlocks Floating Gardens - Open House New York', 'October 22, 2022, 11:00 AM', 'October 22, 2022, 3:00 PM', 'RETI Center BlueCity at GBX~ Gowanus Bay Terminal', 'Talks at noon and 2pm by the designers from thread collective and RETI Center staff. BlueBlocks are modular, floating, semi-submersible structures for challenging urban edge conditions, creating small salt marsh archipelagos that provide a range of ecological benefits for humans and other species. RETI Center BlueCity at GBX~ Gowanus Bay Terminal uses BlueBlocks to create a unique garden on the Red Hook waterfront. The tour will bring you out onto the barge where you will experience a unique spot in the industrial waterfront of New York. These gardens link to the issues of sea level rise, coastal adaptation, and nature-based solutions to create a more resilient future. Learn about the design and fabrication techniques employed to create a hospitable environment for a variety of marine life. In addition, we will showcase the Sugar Kelp marine farm, created in collaboration with LaGuardia College and Lazy Point Farms, that will be launched in the winter months.', 'RETI Center', 'https://www.reticenter.org/events/blueblocks-floating-gardens-open-house-new-york']"
"['ERROR Local Power Info Session (Virtual)', 'October 11, 2022, 6:30 PM', 'October 11, 2022, 8:00 PM', 'Virtual', 'Local Power Community Solar- Info Session on how to Subscribe!', 'Local Power', 'https://www.reticenter.org/events/local-power-info-session-virtual']"
"['ERROR Big Walk 2022', 'October 1, 2022, 10:30 AM ', 'October 1, 2022, 3:30 PM', 'Professor Louise Harpman and other urban enthusiasts', 'CANCELED DUE TO RAIN! WATCH FOR SPRING 2023 DATES', 'PortSide New York, Louis Valentino, Jr. Park and Pier, RETI Center’s BlueCity at the GBX Gowanus Bay Terminal, Culver Viaduct, and the Gowanus Dredgers Canoe Club', 'https://www.reticenter.org/events/big-walk-2022']"
"['ERROR Fridays for Future Volunteer Day', 'September 30, 2022, 4:00 PM', 'September 30, 2022, 8:00 PM', 'RETI Center BlueCity, 701 Columbia St, NY, 11231, United States', 'Fridays for Future is a youth-led and -organized movement that began in August 2018, after 15-year-old Greta Thunberg and other young activists sat in front of the Swedish parliament every schoolday for three weeks to protest against the lack of action on the climate crisis. We honor it with a weekly all-ages volunteer day focused on developing resilient technology and construction projects on our Field Station in the Gowanus Bay. No experience necessary!', '', 'https://www.reticenter.org/events/event-one-3gzx8-xbtms-yfex7-86yms-cyb7z-596wg-pm9ta']"
"['ERROR Fridays for Future Volunteer Day', 'September 23, 2022, 4:00 PM', 'September 23, 2022, 8:00 PM', 'RETI Center BlueCity, 701 Columbia St, NY, 11231, United States', 'Fridays for Future is a youth-led and -organized movement that began in August 2018, after 15-year-old Greta Thunberg and other young activists sat in front of the Swedish parliament every schoolday for three weeks to protest against the lack of action on the climate crisis.', 'None', 'https://www.reticenter.org/events/event-one-3gzx8-xbtms-yfex7-86yms-cyb7z-596wg']"
"['ERROR Fridays for Future Volunteer Day', 'September 16, 2022, 4:00 PM', 'September 16, 2022, 8:00 PM', 'RETI Center BlueCity, 701 Columbia St, NY, 11231, United States', 'Fridays for Future is a youth-led and -organized movement that began in August 2018, after 15-year-old Greta Thunberg and other young activists sat in front of the Swedish parliament every schoolday for three weeks to protest against the lack of action on the climate crisis.', '', 'https://www.reticenter.org/events/event-one-3gzx8']"
['ERROR ']
BS to GPT: Lighting the Path: AAPI Leaders Powering Up the Energy Justice Movement
"['ERROR State Fair', 'August 23, 2023, 12:00 AM', 'September 04, 2023, 12:00 AM', ' Syracuse, NY', "" People from across New York State will come together next year to experience an affordable, 13-day celebration of delicious food, eye-opening exhibits, captivating entertainment, and great fun. Each year’s New York State Fair showcases numerous animals, hundreds of commercial attractions, scores of exciting midway rides, and dozens of big-name entertainers... you'll have a great time, every time!"", ' The Great New York State Fair', 'https://nysfair.ny.gov/']"
"['ERROR Islam, The Environment & The People', 'May 7, 2021, 3:00 PM', 'May 7, 2021, 4:30 PM', 'Not mentioned', 'This THURSDAY we’re super excited to be partnering with @columbia_msa, @baruch.msa.mba.wii & @meca.cornell for a conversation with Ibrahim Abdul Matin @brooklynbedouin, the author of our favorite book Green Deen (if you couldn’t tell from the million times we’ve posted about the book 😂). We’ll be discussing his work as an urban strategist, the intersection between Islam and sustainability, and how we can contribute to the #GreenDeen movement. Let us know what questions you’d like us to ask him!', 'Not mentioned', 'https://www.faithfullysustainable.org/events']"
"['ERROR JOIN THE MARCH TO END FOSSIL FUELS', 'September 17, 2023, 12:00 AM', ' 1:00 PM', ' New York City', "" We deserve a world free from fossil fuels. This is our chance, and Biden's opportunity, to break free from fossil fuels and build a just and safe future."", ' People vs Fossil Fuels', 'https://www.endfossilfuels.us/']"
"['ERROR Storytelling to Boost EV Adoption: Expert Panel', 'Sep 30, 2023, 10:00 - 11:30 am', 'Sep 30, 2023, 11:30 am - 12:00 pm', 'Santa Monica, CA', 'A panel of professional storytellers--writers, filmmakers and others--will share best practices for message creation and effective distribution to boost EV adoption by reaching a mass audience.', 'National Drive Electric Week', 'https://driveelectricweek.org/event']"
